{
  "ramps": {
    "blue": {
      "50": "#EFF9FE", "100": "#DDF2FE", "200": "#C0E8FF", "300": "#9CDAFE", "400": "#73C9F9", "500": "#4FAFE8",
      "600": "#3594D3", "700": "#247ABA", "800": "#1961A0", "900": "#003F8D", "950": "#0E2853"
    },
    "neutral": {
      "0": "#FFFFFF", "25": "#F8FAFD", "50": "#F2F5F8", "100": "#E7ECF1", "150": "#DFE4EB", "200": "#D7DDE4",
      "300": "#BEC5CE", "400": "#9DA5B0", "500": "#7B848F", "600": "#5E6773", "700": "#454E59", "800": "#2E3641",
      "850": "#232B35", "900": "#19202A", "950": "#0D131C", "975": "#060A12"
    },
    "success": { "light": "#045030", "dark": "#65D097", "solid": "#078452" },
    "warning": { "light": "#794D01", "dark": "#F6C88F", "solid": "#D68D0A" },
    "danger": { "light": "#9F2125", "dark": "#FEBFB9", "solid.light": "#C13234", "solid.dark": "#FF958E" },
    "sand": { "200": "#E2D9CB" }
  },
  "special": {
    "loading.background": "#B8B6D6",
    "ink": "#192A44",
    "screen": "#101C2E",
    "screen.solid": "#162336",
    "screen.raised": "#243145",
    "screen.sunk": "#080F1C",
    "nighttext": "#E5F2FD",
    "now": "window.warm",
    "iris.a.light": "#1D97A3",
    "iris.a.dark": "#8DDDE7",
    "iris.b.light": "#6C68A9",
    "iris.b.dark": "#B8B7F0"
  },
  "themes": {
    "light": {
      "surface.panel": "neutral.25@0.94",
      "surface.solid": "neutral.25",
      "surface.raised": "neutral.0",
      "surface.sunk": "neutral.100",
      "surface.selected": "blue.100",
      "surface.frost": "neutral.25@0.84",
      "surface.hover": "blue.400@0.06",
      "surface.row.hover": "blue.300@0.12",
      "text.1": "ink",
      "text.2": "neutral.700",
      "text.off": "neutral.500",
      "text.accent": "blue.800",
      "line.hair": "ink@0.10",
      "line.panel": "ink@0.30",
      "line.control": "neutral.600",
      "line.highlight": "neutral.0@0.70",
      "line.card.hover": "blue.400@0.60",
      "line.scroll": "neutral.600@0.60",
      "primary.fill": "blue.400",
      "primary.hover": "blue.300",
      "primary.press": "blue.500",
      "primary.ink": "ink",
      "primary.line": "blue.800",
      "graphic": "blue.700",
      "led.on": "blue.700",
      "led.halo": "none",
      "glow": "none",
      "now": "now",
      "now.outline": "ink",
      "scrim": "neutral.975@0.35",
      "shadow.ambient": "ink@0.10",
      "shadow.float": "ink@0.14",
      "shadow.float.near": "ink@0.10",
      "iris.a": "iris.a.light",
      "iris.b": "iris.b.light",
      "focus.backing": "neutral.25",
      "trace": "blue.700",
      "tooltip.fill": "neutral.900",
      "tooltip.text": "nighttext",
      "success.text": "success.light",
      "success.fill": "success.solid",
      "warning.text": "warning.light",
      "warning.fill": "warning.solid",
      "danger.text": "danger.light",
      "danger.fill": "danger.solid.light",
      "danger.ink": "neutral.0",
      "info.text": "blue.800",
      "info.fill": "blue.400",
      "moon.fill": "neutral.50",
      "moon.shade": "neutral.400",
      "over.title.band": "neutral.975@0.55",
      "over.title.text": "neutral.25",
      "over.title.shadow": "ink@0.75"
    },
    "dark": {
      "surface.panel": "screen@0.90",
      "surface.solid": "screen.solid",
      "surface.raised": "screen.raised",
      "surface.sunk": "screen.sunk",
      "surface.selected": "blue.950",
      "surface.frost": "screen@0.80",
      "surface.hover": "blue.400@0.06",
      "surface.row.hover": "blue.300@0.12",
      "text.1": "nighttext",
      "text.2": "neutral.300",
      "text.off": "neutral.500",
      "text.accent": "blue.300",
      "line.hair": "neutral.0@0.08",
      "line.panel": "blue.300@0.18",
      "line.control": "neutral.400",
      "line.highlight": "neutral.0@0.06",
      "line.card.hover": "blue.400@0.60",
      "line.scroll": "neutral.400@0.60",
      "primary.fill": "blue.400",
      "primary.hover": "blue.300",
      "primary.press": "blue.500",
      "primary.ink": "neutral.975",
      "primary.line": "blue.300",
      "graphic": "blue.400",
      "led.on": "blue.300",
      "led.halo": "blue.400",
      "glow": "blue.400",
      "now": "now",
      "now.outline": "none",
      "scrim": "neutral.975@0.55",
      "shadow.ambient": "none",
      "shadow.float": "neutral.975@0.40",
      "shadow.float.near": "none",
      "iris.a": "iris.a.dark",
      "iris.b": "iris.b.dark",
      "focus.backing": "screen",
      "trace": "blue.300",
      "tooltip.fill": "neutral.50",
      "tooltip.text": "ink",
      "success.text": "success.dark",
      "success.fill": "success.solid",
      "warning.text": "warning.dark",
      "warning.fill": "warning.solid",
      "danger.text": "danger.dark",
      "danger.fill": "danger.solid.dark",
      "danger.ink": "neutral.975",
      "info.text": "blue.300",
      "info.fill": "blue.400",
      "moon.fill": "neutral.50",
      "moon.shade": "neutral.400",
      "over.title.band": "neutral.975@0.55",
      "over.title.text": "neutral.25",
      "over.title.shadow": "ink@0.75"
    }
  },
  "map": {
    "light": {
      "map.base": { "fill": "neutral.50", "cross": "neutral.300" },
      "map.outskirts": { "line": "neutral.300", "fill": "neutral.100@0.40" },
      "map.edge": { "line": "neutral.400" },
      "map.land": "neutral.25",
      "map.green": { "spring": "#E1F1E2", "summer": "#D9ECDB", "autumn": "#ECEFD9", "winter": "#EEF1F4", "dots": "#7FBF98", "scene": true },
      "map.water": { "fill": "blue.100", "hatch": "blue.300", "shore": "blue.700" },
      "map.plaza": "neutral.100",
      "map.road": { "fill": "neutral.0", "line": "neutral.300" },
      "map.sport": { "line": "neutral.500", "inner": "neutral.400" },
      "map.building": { "fill": "neutral.150", "line": "neutral.500" },
      "map.landmark": { "fill": "sand.200", "line": "blue.800" },
      "map.bound": { "line": "neutral.600" },
      "map.interior": { "fill": "blue.50", "line": "blue.700" },
      "map.label": { "zh": "neutral.700", "en": "neutral.600" },
      "map.label.halo": { "color": "neutral.0@0.90" },
      "map.player": { "fill": "blue.400", "line": "ink", "cone": "blue.400@0.45" }
    },
    "dark": {
      "map.base": { "fill": "neutral.975", "cross": "neutral.800" },
      "map.outskirts": { "line": "neutral.800", "fill": "neutral.950@0.50" },
      "map.edge": { "line": "neutral.700" },
      "map.land": "neutral.950",
      "map.green": { "spring": "#0F2620", "summer": "#0F2620", "autumn": "#1A2316", "winter": "#161D27", "dots": "#2E6B57", "scene": true },
      "map.water": { "fill": "blue.950", "hatch": "blue.800", "shore": "blue.500" },
      "map.plaza": "neutral.900",
      "map.road": { "fill": "neutral.850", "line": "neutral.700" },
      "map.sport": { "line": "neutral.500", "inner": "neutral.600" },
      "map.building": { "fill": "screen.solid", "line": "neutral.600" },
      "map.landmark": { "fill": "neutral.850", "line": "blue.300" },
      "map.bound": { "line": "neutral.400" },
      "map.interior": { "fill": "screen.raised", "line": "blue.400" },
      "map.label": { "zh": "neutral.200", "en": "neutral.400" },
      "map.label.halo": { "color": "neutral.975@0.80" },
      "map.player": { "fill": "blue.400", "line": "neutral.25", "cone": "blue.400@0.45" }
    }
  }
}
